PlanName,CompanyName,Claim_Counts,Claim_Category
"Surakshit Loan Bima","Future Generali India Insurance Co. Ltd.",22,"Least Claimed"
"Chola Group Top Up Protect","Cholamandalam MS General",23,"Least Claimed"
"Star Micro Rural and Farmers Care","Star Health & Allied Insurance Co. Ltd.�",23,"Least Claimed"
"Criti Shield Plus","ICICI Lombard GI Co. Ltd.",54,"Most Claimed"
"Corona Kavach Policy","Niva Bupa Health Insurance co ltd",54,"Most Claimed"
"Star Group Critical Illness Multipay Insurance Policy","Star Health and Allied Insurrance Co.",70,"Most Claimed"
"Group Credit Secure Plus","Tata AIG General Insurance Co. Ltd.",103,"Most Claimed"
